Affrimations,category
Je suis reconnaissant pour beaucoup de choses dans ma vie qui m apportent joie et réconfort,joy
"J ai confiance que ce qui m est destiné est déjà mien, peu importe comment et quand c est le mien",joy
Je suis digne de belles fins et de débuts passionnants,joy
"Je permets à ma voix d être entendue, mes pensées d être exprimées et ma vision d être vue",joy
Je suis ouvert aux choses qui fonctionnent pour moi,joy
Je suis ouvert à recevoir l abondance,joy
Je suis ouvert à la connexion avec mon moi le plus élevé,joy
Je suis éternellement reconnaissant pour toutes les bénédictions que j ai dans ma vie,joy
Je suis heureux et reconnaissant pour tout ce que j ai et reçois quotidiennement,joy
Je me rappelle constamment de profiter de tout le bien que j ai dans ma vie en ce moment,joy
J exprime ma profonde gratitude pour les petits pas que j accomplis chaque jour,joy
"À chaque respiration que je prends, j apporte de plus en plus de gratitude dans ma vie",joy
"Aujourd hui, je vais me concentrer sur un pas en avant, si petit soit-il",joy
Ma vie est significative et importante; Je suis un contributeur précieux au plus grand bien,joy
Je suis digne parce que je le dis,joy
Ma valeur est entre mes mains,joy
Je relâche la pression que je m impose,joy
"Je me donne la permission d avoir confiance en moi, en mes conseils et en mon intuition",joy
Tout le bien de ma vie me vient du fait de ma volonté de trouver le bonheur à chaque instant,joy
Chaque mot gentil que j exprime me revient multiplié,joy
Tout ce qui se passe maintenant se passe pour mon bien ultime,joy
Je sais qu il y aura des obstacles mais j ai la force de les surmonter,joy
Je choisis d être gentille avec moi-même et de m aimer inconditionnellement,joy
Je vois les problèmes comme des défis qui m évoluent et me font grandir,joy
Je traite toujours les autres comme je m attends à être traité,joy
"Chaque jour, même si ce n est que pour quelques minutes, je vais m arrêter et être reconnaissant pour toute la beauté de la vie",joy
"Chaque jour, je serai plus attentif à toutes les petites bénédictions pour lesquelles je devrais être reconnaissant",joy
Je suis reconnaissant qu à chaque expérience je devienne une meilleure version de moi-même,joy
Je crée la possibilité de bonheur pour les autres en étant heureux,joy
Peu importe ce que les autres disent ou font,joy
"Ce qui compte, c est comment je choisis de réagir et ce que je choisis de croire à mon sujet",joy
"Je reviens aux bases de la vie : pardon, courage, gratitude, amour et humour",joy
Je crée une vie qui fait du bien et je suis responsable de mon bonheur,joy
Le bonheur est en moi,joy
Je fonde mon bonheur sur mes propres réalisations et les bénédictions que j ai reçues,joy
Je suis humble et continue d apprendre chaque jour,joy
Être gentil avec les autres est très important pour moi et je fais preuve de gentillesse tout au long de ma journée,joy
"En me concentrant sur la compassion, je me rapporte naturellement aux autres avec amour et compréhension",joy
Je n ai pas peur de ce qui pourrait mal tourner,joy
Je suis ravi de ce qui pourrait bien se passer,joy
"Là où je pense être perdu, je suis prêt à me sentir retrouvé",joy
"Comme je me pardonne, il devient plus facile de pardonner aux autres",joy
J ai la liberté et le pouvoir de créer la vie que je désire,joy
"Jour après jour et pensée après pensée, je crée ma vie idéale!",joy
"Je suis reconnaissant pour tout, le bien et le mal parce que cela m a fait",joy
Je suis prêt à rencontrer des opportunités que je n aurais jamais cru possibles,joy
"Aujourd hui, je choisis de penser positivement et de me créer une vie incroyable et réussie",joy
"Chaque jour, je suis audacieuse, et j avance sur mon chemin avec courage!",joy
Je suis l architecte de ma vie,joy
Je construis sa fondation et choisis son contenu,joy
"Je décore ma vie d espoir, de guérison et de gratitude",joy
"L acceptation de soi, l amour de soi et les soins personnels sont les habitudes que je choisis de cultiver",joy
Je m exerce à aimer ma vie,joy
Je me fais confiance et me tourne vers l intérieur pour rechercher ma plus haute vérité,joy
Je suis digne d un grand amour et je mérite d être aimé pleinement et complètement,joy
"Chaque jour, j apprends de nouvelles leçons, élargis ma conscience et développe mes capacités",joy
"Aujourd hui, je plante les graines de la croissance dans ma vie",joy
Je m engage absolument à les arroser tous les jours,joy
Je me concentre sur la joie de vivre ma vie et d aider les autres où et quand je le peux,joy
Chaque personne sur cette planète enrichit ma vie d une manière ou d'une autre,joy
Je suis reconnaissant à tous,joy
Je me rends compte que chaque situation dans la vie a un but et j en remercie l Univers,joy
"L air que je respire, le sol sur lequel je marche, sont tous un cadeau de l Univers, j exprime ma gratitude pour la même chose",joy
Je suis reconnaissant à l Univers de m avoir permis de prendre naissance et de vivre les expériences de la vie,joy
Je suis reconnaissant à l univers d avoir manifesté toutes les choses merveilleuses de ma vie jusqu à présent,joy
"Avec un sentiment de gratitude, je vois le monde sous un nouveau jour",joy
Chaque jour est une opportunité et un cadeau,joy
"Je suis reconnaissant pour mon sentiment de gratitude - je sais que c est le chemin vers la joie, la paix et la vie de mes rêves",joy
Je vis dans un état de gratitude et je suis toujours reconnaissant pour l aide et le soutien des autres qui m ont aidé en cours de route,joy
Chaque jour est un état constant d apprentissage,joy
"Aujourd hui, je trouve des moyens d être reconnaissant pour ce que j ai tout en étant enthousiasmé par ce qui reste à faire",joy
Des choses merveilleuses m arrivent car je vis avec une attitude de gratitude,joy
"Plus je montre ma gratitude, plus je reçois de bonnes choses pour lesquelles je suis reconnaissant",joy
Je commence chaque journée avec une attitude de gratitude,joy
